{
  "schema_version": "P1008_T2_RESEARCH_CANDIDATE_V1",
  "candidate_id": "T2C-E2E8617A2EFC04E3-643F507A8188",
  "source_candidate_id": "TEST-ONLY-T2-PB-2026-09-18-V1",
  "source_candidate_hash": "E2E8617A2EFC04E371CFB8B748B65996DD63FF83003DAB61B0178D376E1B2A0D",
  "synthetic_fixture": true,
  "metric_id": "TEST_ESTIMATED_PB_MULTIPLE",
  "metric_name": "Synthetic estimated price-to-book multiple",
  "dimension": "VALUATION",
  "period": "2026-09-18",
  "as_of_date": "2026-09-18",
  "point_estimate": "1.905",
  "unit": "MULTIPLE",
  "data_tier": "T2_ESTIMATED_DERIVED",
  "formula_id": "P1008_TEST_ESTIMATED_PB_PRICE_DIV_BVPS",
  "formula_version": "TEST_ONLY_V1",
  "formula_expression": "TEST_CLOSE_TWD / TEST_ESTIMATED_BVPS_TWD",
  "input_metric_ids": ["TEST_CLOSE_TWD", "TEST_ESTIMATED_BVPS_TWD"],
  "input_values": ["200.000", "105.000"],
  "input_units": ["TWD_PER_SHARE", "TWD_PER_SHARE"],
  "input_periods": ["2026-09-18", "2026-09-18"],
  "input_source_ids": ["TEST-OFFICIAL-CLOSE", "TEST-ESTIMATED-BVPS"],
  "input_source_tiers": ["T0_DIRECT_OFFICIAL", "T2_ESTIMATED_DERIVED"],
  "input_source_locators": ["TEST_ONLY://close", "TEST_ONLY://estimated-bvps"],
  "input_hashes": [
    "E02C5F911B381D99EB6778F8898E92CAD5E0213D496F3DF446857DA0444BE85E",
    "C2AE94D195EDE198AC4EEB7A86FF29D0E9E688FA8323E402607993328AB2A10C"
  ],
  "assumptions": ["TEST_ONLY estimated BVPS is used solely to exercise the T2 contract."],
  "rounding_rule": "DECIMAL_HALF_UP_3DP",
  "estimation_method": "ESTIMATED_WITH_DECLARED_ASSUMPTIONS",
  "confidence": "MEDIUM",
  "limitations": ["TEST_ONLY estimated BVPS is not a directly disclosed company value."],
  "estimate_lower_bound": "1.800",
  "estimate_upper_bound": "2.050",
  "range_method": "TEST_ONLY_BVPS_RANGE_RECALCULATION_V1",
  "sensitivity_notes": "TEST_ONLY bounds vary the synthetic estimated BVPS denominator.",
  "semantic_name": "PRICE_TO_BOOK_MULTIPLE",
  "semantic_match_status": "EXACT_MATCH",
  "period_basis": "ALL_INPUT_PERIODS_EQUAL_CANDIDATE_PERIOD",
  "unit_basis": "DIVIDE_SAME_UNITS_TO_MULTIPLE_NO_CONVERSION",
  "denominator_definition": "TEST_ESTIMATED_BVPS_TWD: same-period estimated book value per share in TWD per share",
  "reconciliation_state": "ESTIMATE_ACTIVE",
  "adapter_version": "P1008_T2_ANNOTATED_USE_ADAPTER_V1",
  "adapter_hash": "643F507A8188AD134A00ABE86D2D5A8DC0C2C8A1A3B99C241588595FA98E0180",
  "created_at": "2026-09-18T08:00:00Z",
  "candidate_owner": "WAR_ROOM_RESEARCH",
  "origin": "PLUGIN_DERIVED_T2",
  "display_label_zh": "\u63a8\u4f30\u503c",
  "directly_disclosed": false,
  "claims_official": false,
  "owner_review_required": true,
  "owner_approved_for_annotated_use": false,
  "formal_authority": false,
  "formal_scoring_eligible": false,
  "formal_publish_eligible": false,
  "production_scoring_enabled": false,
  "research_only": true,
  "actionable": false
}
